제목,질문,답변,https://kin.naver.com/search/list.nhn?query=어느+병원+-동물+-성형+-강아지+-피부과+-개인회생+-인테리어+-진로+-커리큘럼+-자동차+-도서+-보험+-교통+-차+-간호학과+-학과&sort=date&period=2019.11.02.|2019.11.06.&section=kin&page=1
생인발? 내성발톱? 뻔떡하면 수술?,제가 얼마전 발톱 깎았는데 좀 짧게 깎아서 지금은 만지면 약간 통증밖엔 없거든요.. 근데 이거 보니까 막 수술해야한다 그러고 첨 알았어요. 이거 자연적으로 낫는방법없나요? 수술보니 마취가 그렇게 아프다고 해서 안할려고하는데 제 상태는 어느정도인가요? 심하진 않은거 같은데 의사선생님들만 답변 부탁드려요.,"내성발톱은 꾸준히 관리를 해줘야하는데,요즘에는 내성발톱 전문 네일샵도 많아요!병원보다는 저는 네일샵을 추천드릴께요​"
내성 발톱,제가 얼마전 발톱 깎았는데 좀 짧게 깎아서 지금은 만지면 약간 통증밖엔 없거든요.. 근데 이거 보니까 막 수술해야한다 그러고 첨 알았어요. 이거 자연적으로 낫는방법없나요? 수술보니 마취가 그렇게 아프다고 해서 안할려고하는데 제 상태는 어느정도인가요? 심하진 않은거 같은데 의사선생님들만 답변 부탁드려요.,의사 선생님은 아지니만 저도 내성 발톱이예요 그래서 자꾸 발톱이 살을 파고 들어가요 병원에 가니깐 발톱을 일자로 자르면 괜찮다고 하더라고요 처음에 일자로 기르기가 힘들어서 그렇지 일자로 자르면 수술 안해도 아프지 않고 잘 다닐수 있어요 경험담이라서 알려드려요
귀 안나빠질까요???,"안녕하세요. 제가 20살 남자인데요. 제가 2년동안 하루종일 거의 이어폰으로 게임하고노래듣고 음악하는게 취미다보니 더 심했는데, 요즘들어서 귀가 너무 답답하고 약간안들리는것 같아서 병원을 1달전에 갔는데 청각이 100이 정상이면 지금 80대후반그렇다는데, 그래서 3,4개월만 끼려는데, 아직은 보청기는 훨씬 안껴도 되나요?오늘도 귀가 답답해서요 답답해도 어느정도 꽤 들려요보청기는 안껴도 아직 되나요? 답변부탁합니다!!! 꽤 먹먹해요. 요즘은 하루 8시간정도끼고 사는데 3,4달만 끼고 살면 귀 안나빠지나요?? 현재는 되게 먹먹한편인데 지금도 그래요보청기 생각은 아직은 한참 이르나요? 버릇땜에 자주 끼고 그래요진짜 귀는 보청기 낄정도만 아니면 지장없다는데, 현재는 매우 답답해요지금도 많이 답답하고 그래여, 그래서 3,4개월 까지만 이어폰끼고 고급 스타렉스에서 살려고요엄마도 하루종일 껴도 멀쩡하다는데, 매일끼니 귀가 먹먹한데 어때요? 딱 3,4달만 진짜루3,4달만 끼고요. 그다음에 바로 스타렉스에서 잠자고 거기서 컴퓨터 설치하고 게임하며 살거에요!그때는 스타렉스에서 잠자고 이어폰 최대한 안낄거에요 3,4개월후에요 지금 심하게 먹먹한데진짜 답변부탁합니다.",공식적으로 이어폰으로 장시간 듣는다면 귀에 좋지않다는 것이 밝혀 졌습니다.이어폰을 최대한 끼지 마시고 스피커나 되도록이면 그냥 귀로 들으세요
귀 안나빠질까요??,"안녕하세요. 제가 20살 남자인데요. 제가 2년동안 하루종일 거의 이어폰으로 게임하고노래듣고 음악하는게 취미다보니 더 심했는데, 요즘들어서 귀가 너무 답답하고 약간안들리는것 같아서 병원을 1달전에 갔는데 청각이 100이 정상이면 지금 80대후반그렇다는데, 그래서 3,4개월만 끼려는데, 아직은 보청기는 훨씬 안껴도 되나요?오늘도 귀가 답답해서요 답답해도 어느정도 꽤 들려요보청기는 안껴도 아직 되나요? 답변부탁합니다!!! 꽤 먹먹해요. 요즘은 하루 8시간정도끼고 사는데 3,4달만 끼고 살면 귀 안나빠지나요?? 현재는 되게 먹먹한편인데 지금도 그래요보청기 생각은 아직은 한참 이르나요? 버릇땜에 자주 끼고 그래요진짜 귀는 보청기 낄정도만 아니면 지장없다는데, 현재는 매우 답답해요지금도 많이 답답하고 그래여, 그래서 3,4개월 까지만 이어폰끼고 고급 스타렉스에서 살려고요엄마도 하루종일 껴도 멀쩡하다는데, 매일끼니 귀가 먹먹한데 어때요? 딱 3,4달만 진짜루3,4달만 끼고요. 그다음에 바로 스타렉스에서 잠자고 거기서 컴퓨터 설치하고 게임하며 살거에요!그때는 스타렉스에서 잠자고 이어폰 최대한 안낄거에요 3,4개월후에요 지금 심하게 먹먹한데진짜 답변부탁합니다.",볼륨을 1칸~2칸으로 하시는 습관을 들이시면조금 더 나아지실 거에요(물론 좋은건 이어폰 안끼는 거지만)
귀 안나빠질까요???,"안녕하세요. 제가 20살 남자인데요. 제가 2년동안 하루종일 거의 이어폰으로 게임하고노래듣고 음악하는게 취미다보니 더 심했는데, 요즘들어서 귀가 너무 답답하고 약간안들리는것 같아서 병원을 1달전에 갔는데 청각이 100이 정상이면 지금 80대후반그렇다는데, 그래서 3,4개월만 끼려는데, 아직은 보청기는 훨씬 안껴도 되나요?오늘도 귀가 답답해서요 답답해도 어느정도 꽤 들려요보청기는 안껴도 아직 되나요? 답변부탁합니다!!! 꽤 먹먹해요. 요즘은 하루 8시간정도끼고 사는데 3,4달만 끼고 살면 귀 안나빠지나요?? 현재는 되게 먹먹한편인데 지금도 그래요보청기 생각은 아직은 한참 이르나요? 버릇땜에 자주 끼고 그래요진짜 귀는 보청기 낄정도만 아니면 지장없다는데, 현재는 매우 답답해요지금도 많이 답답하고 그래여, 그래서 3,4개월 까지만 이어폰끼고 고급 스타렉스에서 살려고요엄마도 하루종일 껴도 멀쩡하다는데, 매일끼니 귀가 먹먹한데 어때요? 딱 3,4달만 진짜루3,4달만 끼고요. 그다음에 바로 스타렉스에서 잠자고 거기서 컴퓨터 설치하고 게임하며 살거에요!그때는 스타렉스에서 잠자고 이어폰 최대한 안낄거에요 3,4개월후에요 지금 심하게 먹먹한데진짜 답변부탁합니다.",지금부터라도 이어폰 끼지마세요 거기서 더 나빠지면 되돌이킬 수 없어요
만약 국내 최고 재벌이,정략결혼을 하겠다 하면은 어느정도의 집안이 되야 대충 사회적 위치가 비슷비슷하나요?,"재계 서열상 같은 급의 다른 재벌집안 또는 강남에 병원건물을 소유하고 있는 병원집안 (실제 매번 이슈를 만들고 있는  h그룹 사위가 이런 집안이죠 ㅎ)또는 유력한 법조인, 정치인 집안 언론사 집안 들이 대표적입니다 재벌과 유명 로펌 자식들의 정략결혼은 이미 유명하고 현재의 재벌 2세들이 결혼했던 6~70년대에는 유력 언론사와 사돈 맺기는 필수였습니다 ​"
약국 처방전,A동네 병원에서 받은 처방전으로 B동네 약국에서 약처방 가능한가요 ??,안녕하세요. 네이버 지식iN 상담 약사 정일영 입니다.​처방전을 가지고는 전국 어느 약국에 가서 약을 조제할 수 있습니다. 단 그 약국에도 처방된 약이나 대체할 수 있는 약이 있어야 합니다.
승모근 없애는법 진짜 미칠것같아요 10대여잔데 무슨옷을 입어도 이상해보이고 저는 목에도 살이 유난히많고 등살도 올라와있고 승모근까지있어서 밖에 다니기 창피해요 어느병원가야하나요? 없애는게 가능한가요?그리고 어깨랑 목사이가 돌처럼 뭉쳐진게 승모근이 발달된거 맞죠?,"... 울화병이 있을 땐 어느 병원을 가야하나요? 안녕하세요, 닥톡-네이버 지식iN 상담한의사 김하나입니다. 현재 울화가 치밀고 화병이 일어나는데 어느 병원을 가서 진료를...",그 부위는 승모근이 있는 곳이긴 합니다근육이 발달 했다면 제거는 어렵습니다병원에서 상담 받고 싶다면 정형외과에 가보는게 좋습니다
발바닥 힘줄 만성염증,"안녕하세요, 18세 고등학생입니다. 취미로 농구를 하며 점프의 필요성을 느껴 점프력을 높이고 싶다는 생각이 들어 헬스장에서 점프력 훈련을 진행했습니다. 그런데 무리를 했는지 며칠 뒤부터 엄지발바닥쪽 뼈부분이 아파왔습니다. 병원에 가보니 엄지 발바닥 쪽 '힘줄'에 염증이 났다고 하더군요; 이후 약도 먹고 물리치료도 받아보고 했지만 크게 나아진 건 없었습니다. 이대로는 안되겠다 싶어 최대한 활동량을 줄이고 하체운동도 일절 하지 않았습니다. 이게 벌써 2달 전입니다. 염증이 있는 엄지발바닥을 피해 걷다보니 이젠 새끼발가락 쪽에도 무리가 오고있습니다. 활동량을 줄여 어느새 지방이 불어났고, 취미인 조깅과 농구, 활발한 활동을 하지 못해 많은 스트레스와 우울감을 느끼고 있습니다..윗글은 하소연이구요^^;*요약*1. 무리한 운동을 지속하여 엄지 발바닥 힘줄에 염증발생2. 병원 치료와 활동량 감소, 운동 중단의 조치에도 염증이 사라지질 않음(!!)*질문*1. 다쳐서 발생한게 아니고 서서히 나타난 염증인데 만성인가요? 급성인가요? 2. 만약 만성이 된거라면 치료 방법은 없을까요?(2-1. 치료방법 없으면 저는 운동을 못하고 사는건가요ㅠㅠ)3. 약국에서 처방해주는 소염제 등은 회복에 영향을 주는게 아니라 염증반응에서 오는 부기와 통증을 줄여주는 거라던데 사실인가요?4. 염증 회복을 빠르게 하는 음식이나 처치법, 생활습관 등등 팁을 주시면 감사하겠습니다.(가장 중요!!)이렇게 오랫동안 어느 부분이 불편해본건 처음이고 심지어 발바닥이라 일상에도 큰 영향을 주니 심적으로 너무 힘드네요..ㅠ빨리 회복하고 싶어서 이렇게 질문 남기니 좋은 답변 부탁드릴게요!!",1 종자골염 같내요.만성 급성을 떠나 엄지발가락이 편형되면서  발생하는 현상입니다​2변형된 발가락을 바르게 잡아주면 염증과 통증이 생기지 않습니다. 발가락 운동용구 듀트을 발가락에 끼우고 걷고 생활하세요 발가락이 바르게 잡히면서 통증과 염증이 생기지 않습니다​3 약과 주사는 염증과 통증을 제거해줄뿐이지 근복적으로 염증증과 통증이 생기지 않게는 못해주므로 약먹고 주사 맞을 때만 효과있는것입니다.​4발가락 운동용구 듀트을 착용하고 걷고 운동하면 발가락이 바르게 잡혀 힘줄 신경 림프 등이 영향을 안주어 통증과 염증이 생기지 않는답니다
조깅을 시작했는데 한쪽 다리만 무릎과 허벅지가 묵직하고 몸이 부었을 때처럼 잘 굽혀지지 않습니다 통증은 없구요 통증이 없으니 병원에 가기도 애매하고 폼플러로 마사지는 해주고 있는데 계속 조깅을 해도 되는 상황인지 모르겠어요검색을 해봐도 다 통증에 관한 내용인데 아프다기 보다는 불편한 느낌이에요 굽혀지지 않는다는 것도 실제로 안굽혀지는건 아니고 뭔가 위화감이 드는 정도? 혹시 제가 어떤 상황에 놓여있는건지 설명해주실 수 있는 분.. ㅠ,"... 울화병이 있을 땐 어느 병원을 가야하나요? 안녕하세요, 닥톡-네이버 지식iN 상담한의사 김하나입니다. 현재 울화가 치밀고 화병이 일어나는데 어느 병원을 가서 진료를...",조깅후에 그런 증상이 있다면 무릎 관절에 체중이 실리고 통증이 가해져 그럴 가능성이 있습니다위화감이 느껴진다면 조깅은 당분간 쉬어주고 무릎에 무리가 가지 않게 우선 안정을 취한후 어느정도 좋아지면 무릎 부위 근력을 키우는 운동부터 해보세요
조깅을 시작했는데 한쪽 다리만 무릎과 허벅지가 묵직하고 몸이 부었을 때처럼 잘 굽혀지지 않습니다 통증은 없구요 통증이 없으니 병원에 가기도 애매하고 폼플러로 마사지는 해주고 있는데 계속 조깅을 해도 되는 상황인지 모르겠어요검색을 해봐도 다 통증에 관한 내용인데 아프다기 보다는 불편한 느낌이에요 굽혀지지 않는다는 것도 실제로 안굽혀지는건 아니고 뭔가 위화감이 드는 정도? 혹시 제가 어떤 상황에 놓여있는건지 설명해주실 수 있는 분.. ㅠ,"... 울화병이 있을 땐 어느 병원을 가야하나요? 안녕하세요, 닥톡-네이버 지식iN 상담한의사 김하나입니다. 현재 울화가 치밀고 화병이 일어나는데 어느 병원을 가서 진료를...","안녕하십니까?지식iN 사룰입니다☜​조깅을 시작했는데 한쪽 다리만 무릎과 허벅지가 묵직하고 몸이 부었을 때처럼 잘 굽혀지지 않습니다 통증은 없구요 통증이 없으니 병원에 가기도 애매하고 폼플러로 마사지는 해주고 있는데 계속 조깅을 해도 되는 상황인지 모르겠어요대퇴사두근 하단 부위의 근육, 힘줄의 긴장으로 인한 증상으로.마사지나 스트레칭은 좋지 않고.당분간 쉬면서 조리하면 금방 좋아집니다.​검색을 해봐도 다 통증에 관한 내용인데 아프다기 보다는 불편한 느낌이에요 굽혀지지 않는다는 것도 실제로 안굽혀지는건 아니고 뭔가 위화감이 드는 정도? 혹시 제가 어떤 상황에 놓여있는건지 설명해주실 수 있는 분.. ㅠ 흔히 있는 증상입니다.새로 운동을 시작하거나 무리하면 그런 증상부터 나타나고.무시해서 운동을 계속하면 통증으로 나타나게 됩니다.붕대를 감거나 보호대를 착용하고.약국에서 소염제를 사서 먹고.무릎뼈와 허벅지 하단 부위에.비닐을 덮어서 한두 시간 간격을 두고 회당 20분 정도 냉찜질을 하루나 이틀 정도 해준 후.온찜질로 바꿔서 수시로 해주면.초기라서 1주에서 10일 정도면 좋아집니다. 아자.​안녕히 계십시오☜ 출처 :무턱대고 병원들 가들 마라. : 분안의학(分案醫學, Separate guidance medicine). ​"
하지정맥 류,"안녕하세요  올해 40대초반 남성입니다.올 7월경 양쪽다리가 저렸고 증상이 하지정맥류와 비슷했습니다.초음파검사 후 하지정맥류가 의심된다고 주사 경화요법을 하자고 하더라구여 그래서 양쪽 다리 1%, 3% 혈관 경화주사 경화요법을 하였습니다.그러나 저림증은 나아지질 않았고 수원에 잘본다는 하지정맥류 병원을 내원하여 초음파 검사를 다시하였습니다.놀랍게도 하지정맥류가 아니랍니다.어쩐지 처음간 병원에서 자꾸 질문하면 하지불안 증후군을 한번 알아봐라 부터 ... 병원 상술에 넘어간거죠... 문제는 하지정맥류가 아닌 상황에서 주사 경화요법을 하였는데 문제 없을까요 ??? 솔직히 이부분이 제일 걸립니다. 정상적인 정맥을 그 의사가 경화시켜서 제기능을 못하게 한거잖습니까? 꼭좀 답변좀 부탁드립니다.","안녕하세요. 흉부외과 전문의 / 의학박사 반동규 원장 입니다.​하지정맥류가 아니더라도 비춰 보이거나 튀어 나와 보이는 혈관이 보기 싫어서 "" 미용상의 목적 "" 에서 시술을 받는 경우도 있습니다.​이는 동맥과 달리 정맥은 "" 병렬구조 "" 로, 어느 구간이 없어지거나 막히더라도 - 다른 주변 정맥으로 순환이 가능하기 때문입니다.​따라서 하지정맥류가 아니었던 정상 혈관이라 할지라도, 문제가 될 것은 없습니다.​다만 말씀하신 1, 3% 라는 것은 약물의 원액 비중으로 뜻하는 것으로 1% 원액도 매우 강력한 성분이 됩니다.​치료 대상이 되는 혈관에 비해 필요 이상으로 강력한 성분의 약제를 사용시에는 "" 혈관염 "" 이 발생할 가능성도 높아지는 만큼, 추후 경과 관찰은 꼭 받으시길 바랍니다.​​​​​​​"
권연침벌 맞을까요?,이사오고부터 계속 이 개미가 보여서 여러종류의 약도 써보고 난리를 피웠는데 죽어서 보이는것도 있지만 이렇게 살아서 보이는것도 많은데 혹시 권연침벌 맞을까요?그리고 물려서 애기 다리가 이렇게까지 부을 수 있는지...병원을 간다면 어느 병원으로 가야될까요ㅠㅠ,권연침벌은 아닌거 같습니다~~너무 많이 부으셨네요..지금은 늦어서 응급실로 가셔야 겠습니다개미 퇴치 방법을 아시려면이곳에 1:1질문을 하시면 퇴치방법을 상세하게 알려주실겁니다https://m.kin.naver.com/profile/index.nhn?u=olRVJwJcdOqyv%2FcOscGvuVqpF0jatKq%2FmRUuMXOA8cs%3D
악몽인지 좋은 꿈인지 걱정인데요.....,안녕하세요! 제가 오늘 꾼 꿈은 너무 무서웠기에..궁금해서요..일어나서도 너무 무서웠구 조금이라도 무서운 느낌이 몸에서 느껴져서요... 어느 한 곳에 무덤이 아주 넓게 파헤쳐있었서요. 구멍이 아주 컸어요. 거기 안에 시체가 있었는데. 해골이였어요. 사람모양의 해골 뼈만 남아있었던.. 너무 무서웠죠. 저는 어둡고 무서웠는데 제가 그 무덤을 똑바로 계속 쳐다보고 있었어요. 너무 어두웠고 무서운 곳이였어요...그리고 어느 장소인지 모르지만. 학교 교실 같은 곳에 사람들이 많았고 친구처럼 대했는데 저를 아는 사람도 있었어요. 남자도 있고 여자도 있고 친했어요. 무덤을 그렇게 똑바로 쳐다보니. 정말 제가 거기에 있는 듯 했어요. 어두운곳에 혼자서 바라보고 있었으니.. 쫌 걱정이되어서요.. 꿈에서 무덤이 나오고 깨끗하게 파헤쳐 있구. 저는 그 큰 무덤을 계속 쳐다보고있엇어요. 꿈 꾸고있는데도.. 몸에서 느낄정도로 무서웠어요.. 이 꿈.. 괜찮은걸까요? 앞으로 어떻게 될지 걱정이네요..ㅠㅠ,"집안에 우환이 들끓거나 상을 당하게 된다. 질병, 교통사고, 변사 등의 불운이 생긴다.​"
악몽인지 좋은 꿈인지 걱정인데요.....,안녕하세요! 제가 오늘 꾼 꿈은 너무 무서웠기에..궁금해서요..일어나서도 너무 무서웠구 조금이라도 무서운 느낌이 몸에서 느껴져서요... 어느 한 곳에 무덤이 아주 넓게 파헤쳐있었서요. 구멍이 아주 컸어요. 거기 안에 시체가 있었는데. 해골이였어요. 사람모양의 해골 뼈만 남아있었던.. 너무 무서웠죠. 저는 어둡고 무서웠는데 제가 그 무덤을 똑바로 계속 쳐다보고 있었어요. 너무 어두웠고 무서운 곳이였어요...그리고 어느 장소인지 모르지만. 학교 교실 같은 곳에 사람들이 많았고 친구처럼 대했는데 저를 아는 사람도 있었어요. 남자도 있고 여자도 있고 친했어요. 무덤을 그렇게 똑바로 쳐다보니. 정말 제가 거기에 있는 듯 했어요. 어두운곳에 혼자서 바라보고 있었으니.. 쫌 걱정이되어서요.. 꿈에서 무덤이 나오고 깨끗하게 파헤쳐 있구. 저는 그 큰 무덤을 계속 쳐다보고있엇어요. 꿈 꾸고있는데도.. 몸에서 느낄정도로 무서웠어요.. 이 꿈.. 괜찮은걸까요? 앞으로 어떻게 될지 걱정이네요..ㅠㅠ,안녕하세요 ^-^★빠르고 정확한 꿈소식 꿈의병원입니다​☞악몽을 꾸는 이유는님이 죄를 짓고 있기 때문입니다님은 신을 믿고 선행을 하며성결히 살아야 할 운명입니다그러니 게임 야동 음주 흡연 욕설 무신론 등을 조심하시옵소서​====[꿈이란]====​하늘은 송신기요사람은 수신기니꿈을 주는 신이 계십니다​꿈을 통해 내 양심과 영혼이 ○좋은 쪽으로 가고 있는지●나쁜 쪽으로 가고 있는지를 알아내는게 가장 큰 수확입니다​​이젠 꿈으로 재물운이나 애정운을보려는 습관을 버리시고꿈으로 내 영혼을 관리하여아름다운 사후세계를 가고자노력해 보세요​​꿈은 신의 달콤하고 조용한 훈계입니다========================
6살난 아들이 많이 아픕니다.,"먼저, 지금도 병마와 싸우는 이땅의 모든 어린이들에게 경의를 표하며 꿈과 희망을 잃지 않기를 바랍니다. 제 아들은 지난 8월경 고열이 시작되어 동네소아병원 및 대전의 c대학병원, 최근 서울의 s대학병원 까지 고열 및 미열 증상이 반복되어 입원후 각종 검사 및 치료를 받았습니다. 최종진단은 원인 불명의 열, 뇌염증상 입니다. 현재 상태는 밤에 잠잘때는 열이 내려 정상 이지만 깨어 있어 활동 할때는 열이 올라 미열 또는 38도 이상 올라가기도 합니다. 어지럽다고 똑바로 잘 서있지도 잘 걷지도 못 하여 수시로 토를 하기도 합니다. 가장 궁금하고 걱정되는건 이러다 큰병이 되는건 아닌지 도대체 어떤 원인으로 인해 이런 증상이 수개월째 반복되는건지 입니다. 대학병원에서도 드문 케이스라하고 정확한 원인을 모르니 제대로 치료가 안되는 상황이고... 답답하기만 합니다. 혹시 비슷한 사례를 겪으셨거나 치유가 되신경우, 원인은 무엇인지, 어느병원 에서 치료받으셨는지, 양방이든 한방이든 어떤 방법이든 알려주시면 고맙겠습니다. 긴글 끝까지 읽어주셔서 감사드리며 추가 내공 1,000 드립니다.","인체에 발병하는 거의 모든 질병들은 인체의 건강한 몸을 지키는 면역력과 깊은 관계가 있습니다.cbc 혈액검사와 함께 cd3, cd4, cd8, cd19의 면역검사를 받아보면 면역수치가 낮은게 확인될 것입니다.검사받은 수치들을 댓글에 적어주세요.혈액검사받은 수치들을 알고있으면 댓글에 우선 적어주세요."
6살난 아들이 많이 아픕니다.,"먼저, 지금도 병마와 싸우는 이땅의 모든 어린이들에게 경의를 표하며 꿈과 희망을 잃지 않기를 바랍니다. 제 아들은 지난 8월경 고열이 시작되어 동네소아병원 및 대전의 c대학병원, 최근 서울의 s대학병원 까지 고열 및 미열 증상이 반복되어 입원후 각종 검사 및 치료를 받았습니다. 최종진단은 원인 불명의 열, 뇌염증상 입니다. 현재 상태는 밤에 잠잘때는 열이 내려 정상 이지만 깨어 있어 활동 할때는 열이 올라 미열 또는 38도 이상 올라가기도 합니다. 어지럽다고 똑바로 잘 서있지도 잘 걷지도 못 하여 수시로 토를 하기도 합니다. 가장 궁금하고 걱정되는건 이러다 큰병이 되는건 아닌지 도대체 어떤 원인으로 인해 이런 증상이 수개월째 반복되는건지 입니다. 대학병원에서도 드문 케이스라하고 정확한 원인을 모르니 제대로 치료가 안되는 상황이고... 답답하기만 합니다. 혹시 비슷한 사례를 겪으셨거나 치유가 되신경우, 원인은 무엇인지, 어느병원 에서 치료받으셨는지, 양방이든 한방이든 어떤 방법이든 알려주시면 고맙겠습니다. 긴글 끝까지 읽어주셔서 감사드리며 추가 내공 1,000 드립니다.","미신이라 근거가 없긴하지만 무당을 찾아 가보시는건 어떨런지요..저도 미신은 잘안 믿는데 신병이나 뭐.. 가끔은 과학에 근거하지 않더라도 초자연적인 현상도 있으니까요..유튜브나 구글, 인터넷 매체에서 간혹 저런경우는 신병이라고 하네요..굿하고 나니까 괜찮아졌다는 후기도 있고.. 흠.. 너무 맹신하는건 좋지 않지만병원에서도 답이 없다면.. 음.."
